{
	"graft": 1,
	"spec": {
		"id": "pending-by-author",
		"hash": "sha256:2c34b9b1a1feb3c866537a5194856d22741cb1ac88428d05e1226dccf1298fe0"
	},
	"surface": {
		"host": "wordpress",
		"hostVersion": "7.1.3",
		"hash": "sha256:23f7adf2048fdfcde868243c14b897e4faceb7c093b9ca6b38f5db07c1116506"
	},
	"mount": {
		"slot": "dashboard.widget",
		"title": "Pending by author"
	},
	"ui": {
		"protocol": "a2ui/v0.9",
		"catalogId": "graft:wordpress",
		"initial": {
			"form": {
				"author": ""
			}
		},
		"computed": {
			"authors": {
				"call": "distinct",
				"args": {
					"items": {
						"path": "/pending/items"
					},
					"by": "author/id"
				}
			},
			"shown": {
				"call": "if",
				"args": {
					"condition": {
						"call": "equals",
						"args": {
							"a": {
								"path": "/form/author"
							},
							"b": ""
						}
					},
					"then": {
						"path": "/pending/items"
					},
					"else": {
						"call": "filter",
						"args": {
							"items": {
								"path": "/pending/items"
							},
							"by": "author/id",
							"equals": {
								"path": "/form/author"
							}
						}
					}
				}
			}
		},
		"components": [
			{
				"id": "root",
				"component": "Column",
				"children": [
					"authors-row",
					"pending-table"
				]
			},
			{
				"id": "authors-row",
				"component": "Row",
				"children": [
					"everyone",
					"author-list"
				]
			},
			{
				"id": "everyone",
				"component": "Button",
				"child": "everyone-label",
				"variant": "default",
				"action": {
					"functionCall": {
						"call": "set",
						"args": {
							"target": "/form/author",
							"value": ""
						}
					}
				}
			},
			{
				"id": "everyone-label",
				"component": "Text",
				"text": "Everyone"
			},
			{
				"id": "author-list",
				"component": "Row",
				"children": {
					"componentId": "author-btn",
					"path": "/authors"
				}
			},
			{
				"id": "author-btn",
				"component": "Button",
				"child": "author-btn-label",
				"variant": "default",
				"actionId": {
					"call": "formatString",
					"args": {
						"value": "author-${lower(value: ${author/name})}"
					}
				},
				"action": {
					"functionCall": {
						"call": "set",
						"args": {
							"target": "/form/author",
							"value": {
								"path": "author/id"
							}
						}
					}
				}
			},
			{
				"id": "author-btn-label",
				"component": "Text",
				"text": {
					"path": "author/name"
				}
			},
			{
				"id": "pending-table",
				"component": "Table",
				"rows": {
					"path": "/shown"
				},
				"fields": [
					{
						"id": "title",
						"label": "Title",
						"type": "string",
						"primary": true
					},
					{
						"id": "author/name",
						"label": "Author",
						"type": "string"
					},
					{
						"id": "date",
						"label": "Date",
						"type": "datetime"
					}
				],
				"rowActions": [
					{
						"id": "approve",
						"label": "Approve",
						"variant": "primary",
						"visible": {
							"call": "can",
							"args": {
								"scope": "posts.status:write"
							}
						},
						"action": {
							"event": {
								"name": "approve",
								"context": {
									"id": {
										"path": "id"
									}
								}
							}
						}
					}
				],
				"empty": "No pending posts."
			}
		]
	},
	"events": {
		"approve": {
			"call": "posts.update_status",
			"input": {
				"id": {
					"$context": "id"
				},
				"status": "publish"
			},
			"then": [
				"refresh:pending"
			],
			"notice": "Post approved and published."
		}
	},
	"data": {
		"pending": {
			"call": "posts.list",
			"input": {
				"post_type": "post",
				"status": [
					"pending"
				],
				"per_page": 100
			}
		}
	},
	"checks": [
		{
			"criterion": "authors",
			"fixtures": {
				"users": [
					{
						"as": "e",
						"role": "editor"
					},
					{
						"as": "ada",
						"role": "contributor",
						"name": "Ada"
					},
					{
						"as": "bob",
						"role": "contributor",
						"name": "Bob"
					}
				],
				"posts": [
					{
						"title": "Ada one",
						"status": "pending",
						"author": "ada"
					},
					{
						"title": "Ada two",
						"status": "pending",
						"author": "ada"
					},
					{
						"title": "Bob one",
						"status": "pending",
						"author": "bob"
					},
					{
						"title": "Ada draft",
						"status": "draft",
						"author": "ada"
					}
				]
			},
			"view_as": "e",
			"expect": [
				{
					"rows": [
						"Ada one",
						"Ada two",
						"Bob one"
					]
				},
				{
					"action": "author-ada"
				},
				{
					"action": "author-bob"
				},
				{
					"action": "everyone"
				}
			]
		},
		{
			"criterion": "filter",
			"fixtures": {
				"users": [
					{
						"as": "e",
						"role": "editor"
					},
					{
						"as": "ada",
						"role": "contributor",
						"name": "Ada"
					},
					{
						"as": "bob",
						"role": "contributor",
						"name": "Bob"
					}
				],
				"posts": [
					{
						"title": "Ada one",
						"status": "pending",
						"author": "ada"
					},
					{
						"title": "Ada two",
						"status": "pending",
						"author": "ada"
					},
					{
						"title": "Bob one",
						"status": "pending",
						"author": "bob"
					},
					{
						"title": "Ada draft",
						"status": "draft",
						"author": "ada"
					}
				]
			},
			"view_as": "e",
			"steps": [
				{
					"action": "author-bob"
				}
			],
			"expect": [
				{
					"rows": [
						"Bob one"
					]
				}
			]
		},
		{
			"criterion": "filter",
			"fixtures": {
				"users": [
					{
						"as": "e",
						"role": "editor"
					},
					{
						"as": "ada",
						"role": "contributor",
						"name": "Ada"
					},
					{
						"as": "bob",
						"role": "contributor",
						"name": "Bob"
					}
				],
				"posts": [
					{
						"title": "Ada one",
						"status": "pending",
						"author": "ada"
					},
					{
						"title": "Ada two",
						"status": "pending",
						"author": "ada"
					},
					{
						"title": "Bob one",
						"status": "pending",
						"author": "bob"
					},
					{
						"title": "Ada draft",
						"status": "draft",
						"author": "ada"
					}
				]
			},
			"view_as": "e",
			"steps": [
				{
					"action": "author-ada"
				}
			],
			"expect": [
				{
					"rows": [
						"Ada one",
						"Ada two"
					]
				}
			]
		},
		{
			"criterion": "everyone",
			"fixtures": {
				"users": [
					{
						"as": "e",
						"role": "editor"
					},
					{
						"as": "ada",
						"role": "contributor",
						"name": "Ada"
					},
					{
						"as": "bob",
						"role": "contributor",
						"name": "Bob"
					}
				],
				"posts": [
					{
						"title": "Ada one",
						"status": "pending",
						"author": "ada"
					},
					{
						"title": "Ada two",
						"status": "pending",
						"author": "ada"
					},
					{
						"title": "Bob one",
						"status": "pending",
						"author": "bob"
					},
					{
						"title": "Ada draft",
						"status": "draft",
						"author": "ada"
					}
				]
			},
			"view_as": "e",
			"steps": [
				{
					"action": "author-bob"
				},
				{
					"action": "everyone"
				}
			],
			"expect": [
				{
					"rows": [
						"Ada one",
						"Ada two",
						"Bob one"
					]
				}
			]
		},
		{
			"criterion": "approve",
			"fixtures": {
				"users": [
					{
						"as": "e",
						"role": "editor"
					},
					{
						"as": "ada",
						"role": "contributor",
						"name": "Ada"
					},
					{
						"as": "bob",
						"role": "contributor",
						"name": "Bob"
					}
				],
				"posts": [
					{
						"title": "Ada one",
						"status": "pending",
						"author": "ada"
					},
					{
						"title": "Ada two",
						"status": "pending",
						"author": "ada"
					},
					{
						"title": "Bob one",
						"status": "pending",
						"author": "bob"
					},
					{
						"title": "Ada draft",
						"status": "draft",
						"author": "ada"
					}
				]
			},
			"view_as": "e",
			"steps": [
				{
					"action": "approve",
					"row": {
						"title": "Bob one"
					}
				}
			],
			"expect": [
				{
					"rows": [
						"Ada one",
						"Ada two"
					]
				},
				{
					"post": {
						"title": "Bob one",
						"status": "publish"
					}
				}
			]
		}
	],
	"refs": {
		"slot": "dashboard.widget",
		"capabilities": [
			"posts.list",
			"posts.update_status"
		],
		"scopes": [
			"posts.status:write",
			"posts:read"
		],
		"catalog": {
			"Button": [
				"action",
				"actionId",
				"child",
				"variant"
			],
			"Column": [
				"children"
			],
			"Row": [
				"children"
			],
			"Table": [
				"empty",
				"fields",
				"rowActions",
				"rows"
			],
			"Text": [
				"text"
			]
		}
	},
	"provenance": {
		"compiler": "graft-compiler/0.1.0+a2ui",
		"model": "claude-opus-5-5",
		"strategy": "compiled"
	}
}
