{
	"graft": 1,
	"spec": {
		"id": "waiting-posts",
		"hash": "sha256:6439a22a8825ac71e9d3a1dbdf018ec714c2ae9d0baa276286ec5dfe6339cc50"
	},
	"surface": {
		"host": "wordpress",
		"hostVersion": "7.1.3",
		"hash": "sha256:c59f39374f6968afbfb21f05ea1bd98c63b0d048d942bada6de39ed61463b193"
	},
	"mount": {
		"slot": "dashboard.widget",
		"title": "Waiting for review"
	},
	"ui": {
		"protocol": "a2ui/v0.9",
		"catalogId": "graft:wordpress",
		"components": [
			{
				"id": "root",
				"component": "Table",
				"rows": {
					"path": "/pending/items"
				},
				"fields": [
					{
						"id": "title",
						"label": "Title",
						"type": "string",
						"primary": true
					},
					{
						"id": "author/name",
						"label": "Author",
						"type": "string"
					}
				],
				"empty": "Nothing is waiting"
			}
		]
	},
	"events": {},
	"data": {
		"pending": {
			"call": "posts.list",
			"input": {
				"post_type": "post",
				"status": [
					"pending"
				],
				"per_page": 5,
				"orderby": "date",
				"order": "desc"
			}
		}
	},
	"checks": [
		{
			"criterion": "pending-only",
			"fixtures": {
				"users": [
					{
						"as": "e",
						"role": "editor"
					}
				],
				"posts": [
					{
						"title": "Draft A",
						"status": "pending"
					},
					{
						"title": "Draft B",
						"status": "draft"
					},
					{
						"title": "Post C",
						"status": "publish"
					}
				]
			},
			"view_as": "e",
			"expect": [
				{
					"rows": [
						"Draft A"
					]
				},
				{
					"columns": [
						"Title",
						"Author"
					]
				}
			]
		},
		{
			"criterion": "at-most-five",
			"fixtures": {
				"users": [
					{
						"as": "e",
						"role": "editor"
					}
				],
				"posts": [
					{
						"title": "P1",
						"status": "pending"
					},
					{
						"title": "P2",
						"status": "pending"
					},
					{
						"title": "P3",
						"status": "pending"
					},
					{
						"title": "P4",
						"status": "pending"
					},
					{
						"title": "P5",
						"status": "pending"
					},
					{
						"title": "P6",
						"status": "pending"
					}
				]
			},
			"view_as": "e",
			"expect": [
				{
					"rows": [
						"P2",
						"P3",
						"P4",
						"P5",
						"P6"
					]
				}
			]
		},
		{
			"criterion": "empty",
			"fixtures": {
				"users": [
					{
						"as": "e",
						"role": "editor"
					}
				],
				"posts": []
			},
			"view_as": "e",
			"expect": [
				{
					"rows": []
				},
				{
					"text": "Nothing is waiting"
				}
			]
		}
	],
	"refs": {
		"slot": "dashboard.widget",
		"capabilities": [
			"posts.list"
		],
		"scopes": [
			"posts:read"
		],
		"catalog": {
			"Table": [
				"empty",
				"fields",
				"rows"
			]
		}
	},
	"provenance": {
		"compiler": "graft-compiler/0.1.0+a2ui",
		"model": "claude-opus-5-5",
		"strategy": "compiled"
	}
}
